{
  "$schema": "../../../contracts/contract.schema.json",
  "capability": "counter.v1.increment",
  "version": "1.0.0",
  "kind": "request",
  "summary": "Add to a named counter (by 1 unless 'by' is given) and return its new value. A counter cannot exceed 1000.",
  "input": {
    "type": "object",
    "required": ["name"],
    "additionalProperties": false,
    "properties": {
      "name": {"type": "string", "minLength": 1},
      "by": {"type": "integer", "minimum": 1}
    }
  },
  "output": {
    "type": "object",
    "required": ["value"],
    "additionalProperties": false,
    "properties": {"value": {"type": "integer", "minimum": 1}}
  },
  "errors": ["limit_exceeded"],
  "examples": [
    {"name": "first", "input": {"name": "visits"}, "output": {"value": 1}, "match": "schema"},
    {"name": "by_five", "input": {"name": "visits", "by": 5}, "output": {"value": 5}, "match": "schema"}
  ],
  "invalid_inputs": [
    {"name": "missing_name", "input": {}},
    {"name": "empty_name", "input": {"name": ""}},
    {"name": "zero_step", "input": {"name": "visits", "by": 0}},
    {"name": "unknown_field", "input": {"name": "visits", "x": 1}}
  ]
}
